<?xml version="1.0" encoding="utf-8"?>
<Content
  Version="3.5"
  xsi:schemaLocation="http://schemas.ntreev.com/crema/tables/Export/ProjectInfo ProjectInfo.xsd"
  ProjectInfo.Modifier="admin"
  ProjectInfo.ModifiedDateTime="2017-10-25T08:34:43.9958704Z"
  ProjectInfo.Count="5"
  ProjectInfo.ID="dea31cbb-0fbd-40b7-9e09-bf11038a3aca"
  ProjectInfo.ExportInfo.ID="a9ca9738-2c3f-41a3-b380-98987977e42e" xmlns:xsi="http://www.w3.org/2001/XMLSchema-instance" xmlns="http://schemas.ntreev.com/crema/tables/Export/ProjectInfo">
  <ProjectInfo
    Creator="admin"
    CreatedDateTime="2017-10-25T04:14:12.2163323Z"
    Modifier="admin"
    ModifiedDateTime="2017-10-25T08:34:43.9958704Z"
    RelationID="1be12bf899f70ed89c8fca12d709c2b7">
    <ProjectPath>sub-modules/Ntreev.ModernUI.Framework/Ntreev.ModernUI.Framework/Ntreev.ModernUI.Framework.csproj</ProjectPath>
  </ProjectInfo>
  <ProjectInfo
    Creator="admin"
    CreatedDateTime="2017-10-25T04:54:50.2168264Z"
    Modifier="admin"
    ModifiedDateTime="2017-10-25T08:34:43.9958704Z"
    RelationID="0d9be3dd1b93b1f4e9d70fb489257e9a">
    <ProjectPath>client/Ntreev.Crema.Client.SmartSet/Properties</ProjectPath>
  </ProjectInfo>
  <ProjectInfo
    Creator="admin"
    CreatedDateTime="2017-10-25T05:56:39.2096651Z"
    Modifier="admin"
    ModifiedDateTime="2017-10-25T08:34:43.9958704Z"
    RelationID="2b63edd87b6adbc62a67f72ba6729c45">
    <ProjectPath>client/Ntreev.Crema.Client.Common/Properties</ProjectPath>
  </ProjectInfo>
  <ProjectInfo
    Creator="admin"
    CreatedDateTime="2017-10-25T06:49:12.8559905Z"
    Modifier="admin"
    ModifiedDateTime="2017-10-25T08:34:43.9958704Z"
    RelationID="4000645526cc7eab95d6c5d1798d8d4a">
    <ProjectPath>client/Ntreev.Crema.Client.Tables/Properties</ProjectPath>
  </ProjectInfo>
  <ProjectInfo
    Creator="admin"
    CreatedDateTime="2017-10-25T07:59:28.3201544Z"
    Modifier="admin"
    ModifiedDateTime="2017-10-25T08:34:43.9958704Z"
    RelationID="890844504c4f92abbf20a513d8d6c79b">
    <ProjectPath>common/Ntreev.Crema.Presentation/Properties</ProjectPath>
  </ProjectInfo>
</Content>